{
  "schema_version": "v1",
  "repo": "psf/black",
  "commit_sha": "1234567890123456789012345678901234567890",
  "license_spdx": "MIT",
  "py_files_in_scope": 42,
  "chunk_count": 97,
  "median_chunk_token_len": 184,
  "drop_rate_over_cap": 0.02,
  "drop_rate_parse_fail": 0.0,
  "duplication_rate": 0.08,
  "secret_scanner_hits": 0,
  "compile_ok_rate": 0.99,
  "per_intent_pair_count": {
    "extract-helper": 14,
    "inline-helper": 6
  }
}
